{
  "$schema": "https://json-schema.org/draft/2020-12/schema",
  "$id": "https://example.com/context-config-schema.json",
  "title": "Context Config Schema",
  "description": "Схема для валидации файлов конфигурации контекста",
  "type": "object",
  "required": [
    "config_version",
    "instruction",
    "type",
    "meta",
    "key_data",
    "recent_context",
    "immediate_next_step",
    "parent_settings"
  ],
  "properties": {
    "config_version": {
      "type": "string",
      "pattern": "^\\d+\\.\\d+(\\.\\d+)?$"
    },
    "instruction": { "type": "string" },
    "type": {
      "type": "string",
      "enum": ["full_export", "selective_export", "return_export"]
    },
    "parent_topic": { "type": "string" },
    "selected_topic": { "type": "string" },
    "meta": {
      "type": "object",
      "required": ["core_topic", "conversation_style", "user_profile"],
      "properties": {
        "core_topic": { "type": "string" },
        "conversation_style": { "type": "string" },
        "user_profile": { "type": "string" },
        "branch_id": { "type": "string" }
      }
    },
    "key_data": {
      "type": "object",
      "required": ["achievements", "constraints", "important_facts", "artifacts"],
      "properties": {
        "achievements": {
          "type": "array",
          "items": { "type": "string" }
        },
        "constraints": {
          "type": "array",
          "items": { "type": "string" }
        },
        "important_facts": {
          "type": "array",
          "items": { "type": "string" }
        },
        "artifacts": {
          "type": "array",
          "items": { "type": "string" }
        }
      }
    },
    "recent_context": {
      "type": "array",
      "items": {
        "type": "object",
        "required": ["role", "content"],
        "properties": {
          "role": { "type": "string" },
          "content": { "type": "string" }
        }
      }
    },
    "immediate_next_step": { "type": "string" },
    "parent_settings": {
      "type": "object",
      "required": [
        "auto_summary_enabled",
        "auto_summary_interval",
        "default_response_format",
        "verbosity_level"
      ],
      "properties": {
        "auto_summary_enabled": { "type": "boolean" },
        "auto_summary_interval": { "type": "integer" },
        "default_response_format": { "type": "string" },
        "verbosity_level": { "type": "string" }
      }
    }
  },
  "additionalProperties": false,
  "if": {
    "properties": { "type": { "const": "selective_export" } }
  },
  "then": {
    "required": ["parent_topic", "selected_topic"]
  },
  "else": {
    "if": {
      "properties": { "type": { "const": "return_export" } }
    },
    "then": {
      "required": ["parent_topic", "selected_topic"]
    }
  }
}