{
  "config_version": "1.5.1",
  "instruction": "Воспринимай данные ниже как контекст выделенной темы из основного обсуждения. ЗАГРУЗИ их в память. Выведи ТОЛЬКО стандартную подсказку с указанием, что чат создан для углубленной проработки отдельного вопроса.",
  "type": "selective_export",
  "parent_topic": "Проверка работы протокола версии 1.5 - ИТОГОВЫЙ ОТЧЕТ",
  "selected_topic": "Рекомендации",
  "meta": {
    "core_topic": "Рекомендации по итогам тестирования протокола v1.5",
    "conversation_style": "технический, аналитический",
    "user_profile": "Тестировщик протокола. Цель: детальная проработку рекомендаций."
  },
  "key_data": {
    "achievements": [
      "Принято решение о переводе протокола в JSON-формат для повышения точности",
      "Разработан и принят план внедрения рекомендаций (v1.5.1, v1.6, v1.7)",
      "Реализовано управление версиями config_version в формате данных"
    ],
    "constraints": [
      "Требуется строгое соблюдение формата команд",
      "Обеспечение обратной совместимости при обновлении протокола"
    ],
    "important_facts": [
      "Протокол v1.5 признан работоспособным и эффективным",
      "Приоритет P0: добавление config_version (реализовано)",
      "Приоритет P1: строгая валидация JSON-конфигов (в работе)"
    ],
    "artifacts": [
      "P0: Добавление config_version во все JSON-конфиги (реализовано)",
      "P1: Реализация строгой JSON-валидации конфигов (в процессе)",
      "P2: Улучшение обработки ошибок валидации (запланировано)"
    ]
  },
  "recent_context": [
    {
      "role": "user",
      "content": "//СОХРАНИТЬ_КОНФИГ"
    },
    {
      "role": "assistant",
      "content": "[КОНФИГ СОХРАНЕН] ..."
    }
  ],
  "immediate_next_step": "Продолжить глубокую проработку темы Рекомендации: формализация JSON Schema, проектирование архитектуры валидатора для версии 1.6.",
  "parent_settings": {
    "auto_summary_enabled": true,
    "auto_summary_interval": 3,
    "default_response_format": "markdown",
    "verbosity_level": "normal"
  }
}